"Story","Title","Result","Date","Stability","Duration (s)"
"To Test Admin menu User Groups in Organisation Option","To Test Admin menu User Groups in Organisation Option","SUCCESS","2023-11-20T17:59:55.4829164+05:30[Asia/Calcutta]","0.0","101.56"
"To Test Admin menu Business Entities in Organisation Option","To Test Admin menu Business Entities in Organisation Option","SUCCESS","2023-11-20T18:01:38.1468682+05:30[Asia/Calcutta]","0.0","97.38"
"To Test Admin menu Indicator Statements in Risk Framework option","To Test Admin menu Indicator Statements New Standard Statement in Risk Framework option","SUCCESS","2023-11-20T18:03:16.5013073+05:30[Asia/Calcutta]","0.0","107.56"
"To Test Admin menu Indicator Statements in Risk Framework option","To Test Admin menu Indicator Statements New Register Statement in Risk Framework option","SUCCESS","2023-11-20T18:06:18.0835771+05:30[Asia/Calcutta]","0.0","103.94"
"To Test Admin menu Risk Map builder in Risk Framework option","To Test Admin menu Risk Map builder in Risk Framework option","SUCCESS","2023-11-20T18:08:02.983289+05:30[Asia/Calcutta]","0.0","117.29"
"To Test Admin menu Requirements in Task Admin Option","To Test Admin menu Requirements in Task Admin Optionn","SUCCESS","2023-11-20T18:12:08.9999439+05:30[Asia/Calcutta]","0.0","114.71"
